{
  "schema_version": "engineering_construction_rules.v1",
  "description": "Deterministic construction rulebook mapping frozen repository_facts.v2 observations to EngineeringModel nodes, relationships, identities, evidence, unresolved candidates, and validation invariants. This file is the rulebook, not the graph.",
  "input": {
    "fact_schema": "repository_facts.v2",
    "notes": "Read repository observations exclusively from facts[]. Do not use counts() or removed repository.files keys."
  },
  "classification_vocabulary": [
    "observed",
    "derived",
    "inferred",
    "conflicting"
  ],
  "node_vocabulary": [
    {
      "kind": "artifact",
      "subkinds": [
        "file",
        "directory",
        "agent_definition",
        "agent_command",
        "agent_config",
        "mcp_config",
        "mcp_server_source"
      ]
    },
    {
      "kind": "code_entity",
      "subkinds": [
        "module",
        "class",
        "function"
      ]
    },
    {
      "kind": "external_package",
      "subkinds": [
        "package"
      ]
    },
    {
      "kind": "tool",
      "subkinds": [
        "mcp",
        "built_in"
      ]
    },
    {
      "kind": "mcp_server",
      "subkinds": [
        "registered"
      ]
    }
  ],
  "relationship_vocabulary": [
    "IMPORTS",
    "DEPENDS_ON",
    "CONTAINS",
    "TRIGGERS",
    "DECLARES",
    "EXPOSED_BY",
    "CONFIGURED_BY"
  ],
  "node_rules": [
    {
      "rule_id": "node.file.repository_file",
      "match": {
        "fact_type": "file",
        "kind": "repository_file"
      },
      "action": "CREATE_NODE",
      "node": {
        "kind": "artifact",
        "subkind": "file"
      },
      "identity": {
        "template": "artifact:file:{path}",
        "from_attributes": [
          "path"
        ],
        "deterministic": true
      },
      "classification": "observed",
      "requires_evidence": true,
      "dedupe_by": "identity",
      "notes": "Canonical physical file node. Configuration/documentation/test facts for the same path must not create a second file node."
    },
    {
      "rule_id": "node.directory.repository_directory",
      "match": {
        "fact_type": "directory",
        "kind": "repository_directory"
      },
      "action": "CREATE_NODE",
      "node": {
        "kind": "artifact",
        "subkind": "directory"
      },
      "identity": {
        "template": "artifact:directory:{path}",
        "from_attributes": [
          "path"
        ],
        "deterministic": true
      },
      "classification": "observed",
      "requires_evidence": true,
      "dedupe_by": "identity"
    },
    {
      "rule_id": "node.entity.module",
      "match": {
        "fact_type": "entity",
        "kind": "module"
      },
      "action": "CREATE_NODE",
      "node": {
        "kind": "code_entity",
        "subkind": "module"
      },
      "identity": {
        "template": "code_entity:{path}",
        "from_attributes": [
          "path"
        ],
        "deterministic": true
      },
      "classification": "observed",
      "requires_evidence": true,
      "dedupe_by": "identity",
      "notes": "Identity describes the engineering module (repository path), not the analyzer that discovered it (no python-module:/ast-module: prefixes)."
    },
    {
      "rule_id": "node.entity.class",
      "match": {
        "fact_type": "entity",
        "kind": "class"
      },
      "action": "CREATE_NODE",
      "node": {
        "kind": "code_entity",
        "subkind": "class"
      },
      "identity": {
        "template": "code_entity:{entity_key}",
        "from_attributes": [
          "path",
          "qualified_name"
        ],
        "deterministic": true
      },
      "classification": "observed",
      "requires_evidence": true,
      "dedupe_by": "identity",
      "notes": "Identity normalizes M2 path + qualified_name so the repository path appears once (e.g. code_entity:src/service.py::Service)."
    },
    {
      "rule_id": "node.entity.function",
      "match": {
        "fact_type": "entity",
        "kind": "function"
      },
      "action": "CREATE_NODE",
      "node": {
        "kind": "code_entity",
        "subkind": "function"
      },
      "identity": {
        "template": "code_entity:{entity_key}",
        "from_attributes": [
          "path",
          "qualified_name"
        ],
        "deterministic": true
      },
      "classification": "observed",
      "requires_evidence": true,
      "dedupe_by": "identity",
      "notes": "Identity normalizes M2 path + qualified_name so the repository path appears once (e.g. code_entity:src/service.py::run). Redefined symbols share qualified_name; line is not part of node identity in V1."
    },
    {
      "rule_id": "node.artifact.agent_definition",
      "match": {
        "fact_type": "artifact",
        "kind": "agent_definition"
      },
      "action": "CREATE_NODE",
      "node": {
        "kind": "artifact",
        "subkind": "agent_definition"
      },
      "identity": {
        "template": "artifact:agent_definition:{path}",
        "from_attributes": [
          "path"
        ],
        "deterministic": true
      },
      "classification": "observed",
      "requires_evidence": true,
      "dedupe_by": "identity",
      "notes": "Specialized repository artifact. Not architecture concept:agent / service / workflow."
    },
    {
      "rule_id": "node.artifact.agent_command",
      "match": {
        "fact_type": "artifact",
        "kind": "agent_command"
      },
      "action": "CREATE_NODE",
      "node": {
        "kind": "artifact",
        "subkind": "agent_command"
      },
      "identity": {
        "template": "artifact:agent_command:{path}",
        "from_attributes": [
          "path"
        ],
        "deterministic": true
      },
      "classification": "observed",
      "requires_evidence": true,
      "dedupe_by": "identity"
    },
    {
      "rule_id": "node.artifact.agent_config",
      "match": {
        "fact_type": "artifact",
        "kind": "agent_config"
      },
      "action": "CREATE_NODE",
      "node": {
        "kind": "artifact",
        "subkind": "agent_config"
      },
      "identity": {
        "template": "artifact:agent_config:{path}",
        "from_attributes": [
          "path"
        ],
        "deterministic": true
      },
      "classification": "observed",
      "requires_evidence": true,
      "dedupe_by": "identity"
    },
    {
      "rule_id": "node.artifact.mcp_config",
      "match": {
        "fact_type": "artifact",
        "kind": "mcp_config"
      },
      "action": "CREATE_NODE",
      "node": {
        "kind": "artifact",
        "subkind": "mcp_config"
      },
      "identity": {
        "template": "artifact:mcp_config:{path}",
        "from_attributes": [
          "path"
        ],
        "deterministic": true
      },
      "classification": "observed",
      "requires_evidence": true,
      "dedupe_by": "identity"
    },
    {
      "rule_id": "node.artifact.mcp_server_source",
      "match": {
        "fact_type": "artifact",
        "kind": "mcp_server_source"
      },
      "action": "CREATE_NODE",
      "node": {
        "kind": "artifact",
        "subkind": "mcp_server_source"
      },
      "identity": {
        "template": "artifact:mcp_server_source:{path}",
        "from_attributes": [
          "path"
        ],
        "deterministic": true
      },
      "classification": "observed",
      "requires_evidence": true,
      "dedupe_by": "identity"
    },
    {
      "rule_id": "node.artifact.mcp_documentation",
      "match": {
        "fact_type": "artifact",
        "kind": "mcp_documentation"
      },
      "action": "EVIDENCE_ONLY",
      "node": {
        "kind": "artifact",
        "subkind": "mcp_documentation"
      },
      "identity": {
        "template": "artifact:mcp_documentation:{path}",
        "from_attributes": [
          "path"
        ],
        "deterministic": true
      },
      "classification": "observed",
      "requires_evidence": true,
      "notes": "Evidence-only: describes an aspect of a path that already has (or may have) a canonical file/artifact node."
    },
    {
      "rule_id": "node.artifact.markdown",
      "match": {
        "fact_type": "artifact",
        "kind": "markdown"
      },
      "action": "EVIDENCE_ONLY",
      "node": {
        "kind": "artifact",
        "subkind": "markdown"
      },
      "identity": {
        "template": "artifact:markdown:{path}",
        "from_attributes": [
          "path"
        ],
        "deterministic": true
      },
      "classification": "observed",
      "requires_evidence": true,
      "notes": "Evidence-only: same physical file may already be artifact:file."
    },
    {
      "rule_id": "node.artifact.python",
      "match": {
        "fact_type": "artifact",
        "kind": "python"
      },
      "action": "EVIDENCE_ONLY",
      "node": {
        "kind": "artifact",
        "subkind": "python"
      },
      "identity": {
        "template": "artifact:python:{path}",
        "from_attributes": [
          "path"
        ],
        "deterministic": true
      },
      "classification": "observed",
      "requires_evidence": true,
      "notes": "Evidence-only: MCP/python side facts; module nodes come from entity/module."
    },
    {
      "rule_id": "node.artifact.shell",
      "match": {
        "fact_type": "artifact",
        "kind": "shell"
      },
      "action": "EVIDENCE_ONLY",
      "node": {
        "kind": "artifact",
        "subkind": "shell"
      },
      "identity": {
        "template": "artifact:shell:{path}",
        "from_attributes": [
          "path"
        ],
        "deterministic": true
      },
      "classification": "observed",
      "requires_evidence": true,
      "notes": "Evidence-only: same physical file may already be artifact:file."
    },
    {
      "rule_id": "node.configuration.file",
      "match": {